========================================= UC1 =========================================

mysql> CREATE DATABASE addressbook_DB;
Query OK, 1 row affected (0.00 sec)

mysql> USE addressbook_DB;
Database changed
mysql> SELECT DATABASE();
+----------------+
| DATABASE()     |
+----------------+
| addressbook_db |
+----------------+
1 row in set (0.00 sec)


========================================= UC2 =========================================


mysql> CREATE TABLE addressbook_table (
    -> firstName varchar(50) NOT NULL,
    -> lastName  varchar(50) NOT NULL,
    -> address varchar(100),
    -> city varchar(20),
    -> state varchar(50),
    -> zip varchar(10),
    -> phone_number varchar(15),
    -> email_address varchar(50)
    -> );
Query OK, 0 rows affected (0.02 sec)

mysql> Describe Addressbook_table;
+---------------+--------------+------+-----+---------+-------+
| Field         | Type         | Null | Key | Default | Extra |
+---------------+--------------+------+-----+---------+-------+
| firstName     | varchar(50)  | NO   |     | NULL    |       |
| lastName      | varchar(50)  | NO   |     | NULL    |       |
| address       | varchar(100) | YES  |     | NULL    |       |
| city          | varchar(20)  | YES  |     | NULL    |       |
| state         | varchar(50)  | YES  |     | NULL    |       |
| zip           | varchar(10)  | YES  |     | NULL    |       |
| phone_number  | varchar(15)  | YES  |     | NULL    |       |
| email_address | varchar(50)  | YES  |     | NULL    |       |
+---------------+--------------+------+-----+---------+-------+
8 rows in set (0.01 sec)


========================================= UC3 =========================================


mysql> INSERT INTO addressbook_table ( firstName, lastName, address, city, state, zip, phone_number, email_address) VALUES
    -> ('Hitesh','Meher','Bhubaneswar','Khordha','Odisha','751024','7008784018','meher.hitesh3@gmail.com'),
    -> ('Priyanka','Chopra','Bandra','Mumbai','Maharashtra','411005','9999999999','priyanka@gmail.com'),
    -> ('Nagarjuna','Akkineni','NuaBazar','Kondal','AndhraPradesh','356005','1234567890','nagarjuna@gmail.com'),
    -> ('Neha','kakkar','Kothrud','Pune','Maharashtra','411007','7092814637','nehukakkar@gmail.com');
Query OK, 4 rows affected (0.01 sec)
Records: 4  Duplicates: 0  Warnings: 0

mysql> SELECT * FROM addressbook_table;
+-----------+----------+-------------+---------+---------------+--------+--------------+-------------------------+
| firstName | lastName | address     | city    | state         | zip    | phone_number | email_address           |
+-----------+----------+-------------+---------+---------------+--------+--------------+-------------------------+
| Hitesh    | Meher    | Bhubaneswar | Khordha | Odisha        | 751024 | 7008784018   | meher.hitesh3@gmail.com |
| Priyanka  | Chopra   | Bandra      | Mumbai  | Maharashtra   | 411005 | 9999999999   | priyanka@gmail.com      |
| Nagarjuna | Akkineni | NuaBazar    | Kondal  | AndhraPradesh | 356005 | 1234567890   | nagarjuna@gmail.com     |
| Neha      | kakkar   | Kothrud     | Pune    | Maharashtra   | 411007 | 7092814637   | nehukakkar@gmail.com    |
+-----------+----------+-------------+---------+---------------+--------+--------------+-------------------------+
4 rows in set (0.00 sec)


========================================= UC4 =========================================


mysql> UPDATE addressbook_table SET zip = '111111' WHERE firstName = 'Priyanka';
Query OK, 1 row affected (0.01 sec)
Rows matched: 1  Changed: 1  Warnings: 0

mysql> SELECT * FROM addressbook_table;
+-----------+----------+-------------+---------+---------------+--------+--------------+-------------------------+
| firstName | lastName | address     | city    | state         | zip    | phone_number | email_address           |
+-----------+----------+-------------+---------+---------------+--------+--------------+-------------------------+
| Hitesh    | Meher    | Bhubaneswar | Khordha | Odisha        | 751024 | 7008784018   | meher.hitesh3@gmail.com |
| Priyanka  | Chopra   | Bandra      | Mumbai  | Maharashtra   | 111111 | 9999999999   | priyanka@gmail.com      |
| Nagarjuna | Akkineni | NuaBazar    | Kondal  | AndhraPradesh | 356005 | 1234567890   | nagarjuna@gmail.com     |
| Neha      | kakkar   | Kothrud     | Pune    | Maharashtra   | 411007 | 7092814637   | nehukakkar@gmail.com    |
+-----------+----------+-------------+---------+---------------+--------+--------------+-------------------------+
4 rows in set (0.00 sec)


========================================= UC5 =========================================


mysql> DELETE FROM addressbook_table WHERE firstName = 'Nagarjuna';
Query OK, 1 row affected (0.01 sec)

mysql> SELECT * FROM addressbook_table;
+-----------+----------+-------------+---------+-------------+--------+--------------+-------------------------+
| firstName | lastName | address     | city    | state       | zip    | phone_number | email_address           |
+-----------+----------+-------------+---------+-------------+--------+--------------+-------------------------+
| Hitesh    | Meher    | Bhubaneswar | Khordha | Odisha      | 751024 | 7008784018   | meher.hitesh3@gmail.com |
| Priyanka  | Chopra   | Bandra      | Mumbai  | Maharashtra | 111111 | 9999999999   | priyanka@gmail.com      |
| Neha      | kakkar   | Kothrud     | Pune    | Maharashtra | 411007 | 7092814637   | nehukakkar@gmail.com    |
+-----------+----------+-------------+---------+-------------+--------+--------------+-------------------------+
3 rows in set (0.00 sec)


========================================= UC6 =========================================


mysql> SELECT firstName FROM addressbook_table WHERE state = 'Maharashtra';
+-----------+
| firstName |
+-----------+
| Priyanka  |
| Neha      |
+-----------+
2 rows in set (0.00 sec)

mysql> SELECT firstName FROM addressbook_table WHERE city = 'Mumbai';
+-----------+
| firstName |
+-----------+
| Priyanka  |
+-----------+
1 row in set (0.00 sec)


========================================= UC7 =========================================


mysql> SELECT state, city, COUNT(firstName) FROM addressbook_table GROUP BY state, city;
+-------------+---------+------------------+
| state       | city    | COUNT(firstName) |
+-------------+---------+------------------+
| Odisha      | Khordha |                1 |
| Maharashtra | Mumbai  |                1 |
| Maharashtra | Pune    |                1 |
+-------------+---------+------------------+
3 rows in set (0.00 sec)


========================================= UC8 =========================================


mysql> INSERT INTO addressbook_table (firstName, lastName, address, city, state, zip, phone_number, email_address) VALUES
    -> ('Aditya','Kumar','CDA','Cuttack','Odisha','753014','9638527410','aditya.kumar@yahoo.com'),
    -> ('Khusi','Rout','junagarh','Kalahandi','Odisha','766001','2323231574','khusirout999@yahoo.com');
Query OK, 2 rows affected (0.00 sec)
Records: 2  Duplicates: 0  Warnings: 0

mysql> SELECT * FROM addressbook_table;
+-----------+----------+-------------+-----------+-------------+--------+--------------+-------------------------+
| firstName | lastName | address     | city      | state       | zip    | phone_number | email_address           |
+-----------+----------+-------------+-----------+-------------+--------+--------------+-------------------------+
| Hitesh    | Meher    | Bhubaneswar | Khordha   | Odisha      | 751024 | 7008784018   | meher.hitesh3@gmail.com |
| Priyanka  | Chopra   | Bandra      | Mumbai    | Maharashtra | 111111 | 9999999999   | priyanka@gmail.com      |
| Neha      | kakkar   | Kothrud     | Pune      | Maharashtra | 411007 | 7092814637   | nehukakkar@gmail.com    |
| Aditya    | Kumar    | CDA         | Cuttack   | Odisha      | 753014 | 9638527410   | aditya.kumar@yahoo.com  |
| Khusi     | Rout     | junagarh    | Kalahandi | Odisha      | 766001 | 2323231574   | khusirout999@yahoo.com  |
+-----------+----------+-------------+-----------+-------------+--------+--------------+-------------------------+
5 rows in set (0.00 sec)

mysql> SELECT * FROM addressbook_table WHERE state = 'Odisha' ORDER BY firstName;
+-----------+----------+-------------+-----------+--------+--------+--------------+-------------------------+
| firstName | lastName | address     | city      | state  | zip    | phone_number | email_address           |
+-----------+----------+-------------+-----------+--------+--------+--------------+-------------------------+
| Aditya    | Kumar    | CDA         | Cuttack   | Odisha | 753014 | 9638527410   | aditya.kumar@yahoo.com  |
| Hitesh    | Meher    | Bhubaneswar | Khordha   | Odisha | 751024 | 7008784018   | meher.hitesh3@gmail.com |
| Khusi     | Rout     | junagarh    | Kalahandi | Odisha | 766001 | 2323231574   | khusirout999@yahoo.com  |
+-----------+----------+-------------+-----------+--------+--------+--------------+-------------------------+
3 rows in set (0.00 sec)



========================================= UC9 =========================================


mysql> ALTER TABLE addressbook_table ADD COLUMN type varchar(50), ADD bookName varchar(15) NOT NULL ;
Query OK, 0 rows affected (0.02 sec)
Records: 0  Duplicates: 0  Warnings: 0

mysql> DESCRIBE addressbook_table;
+---------------+--------------+------+-----+---------+-------+
| Field         | Type         | Null | Key | Default | Extra |
+---------------+--------------+------+-----+---------+-------+
| firstName     | varchar(50)  | NO   |     | NULL    |       |
| lastName      | varchar(50)  | NO   |     | NULL    |       |
| address       | varchar(100) | YES  |     | NULL    |       |
| city          | varchar(20)  | YES  |     | NULL    |       |
| state         | varchar(50)  | YES  |     | NULL    |       |
| zip           | varchar(10)  | YES  |     | NULL    |       |
| phone_number  | varchar(15)  | YES  |     | NULL    |       |
| email_address | varchar(50)  | YES  |     | NULL    |       |
| type          | varchar(50)  | YES  |     | NULL    |       |
| bookName      | varchar(15)  | NO   |     | NULL    |       |
+---------------+--------------+------+-----+---------+-------+
10 rows in set (0.00 sec)

mysql> SELECT * FROM addressbook_table;
+-----------+----------+-------------+-----------+-------------+--------+--------------+-------------------------+------+----------+
| firstName | lastName | address     | city      | state       | zip    | phone_number | email_address           | type | bookName |
+-----------+----------+-------------+-----------+-------------+--------+--------------+-------------------------+------+----------+
| Hitesh    | Meher    | Bhubaneswar | Khordha   | Odisha      | 751024 | 7008784018   | meher.hitesh3@gmail.com | NULL |          |
| Priyanka  | Chopra   | Bandra      | Mumbai    | Maharashtra | 111111 | 9999999999   | priyanka@gmail.com      | NULL |          |
| Neha      | kakkar   | Kothrud     | Pune      | Maharashtra | 411007 | 7092814637   | nehukakkar@gmail.com    | NULL |          |
| Aditya    | Kumar    | CDA         | Cuttack   | Odisha      | 753014 | 9638527410   | aditya.kumar@yahoo.com  | NULL |          |
| Khusi     | Rout     | junagarh    | Kalahandi | Odisha      | 766001 | 2323231574   | khusirout999@yahoo.com  | NULL |          |
+-----------+----------+-------------+-----------+-------------+--------+--------------+-------------------------+------+----------+
5 rows in set (0.00 sec)

mysql> UPDATE addressbook_table SET bookName = 'One' , type = 'family' WHERE firstName = 'Hitesh';
Query OK, 1 row affected (0.00 sec)
Rows matched: 1  Changed: 1  Warnings: 0

mysql> UPDATE addressbook_table SET bookName = 'Two' , type = 'family' WHERE firstName = 'Priyanka';
Query OK, 1 row affected (0.00 sec)
Rows matched: 1  Changed: 1  Warnings: 0

mysql> UPDATE addressbook_table SET bookName = 'Two' , type = 'friend' WHERE firstName = 'Neha';
Query OK, 1 row affected (0.00 sec)
Rows matched: 1  Changed: 1  Warnings: 0

mysql> UPDATE addressbook_table SET bookName = 'One' , type = 'friend' WHERE firstName = 'Aditya';
Query OK, 1 row affected (0.00 sec)
Rows matched: 1  Changed: 1  Warnings: 0

mysql> UPDATE addressbook_table SET bookName = 'One' , type = 'profession' WHERE firstName = 'Khusi';
Query OK, 1 row affected (0.00 sec)
Rows matched: 1  Changed: 1  Warnings: 0

mysql> SELECT * FROM addressbook_table;
+-----------+----------+-------------+-----------+-------------+--------+--------------+-------------------------+------------+----------+
| firstName | lastName | address     | city      | state       | zip    | phone_number | email_address           | type       | bookName |
+-----------+----------+-------------+-----------+-------------+--------+--------------+-------------------------+------------+----------+
| Hitesh    | Meher    | Bhubaneswar | Khordha   | Odisha      | 751024 | 7008784018   | meher.hitesh3@gmail.com | family     | One      |
| Priyanka  | Chopra   | Bandra      | Mumbai    | Maharashtra | 111111 | 9999999999   | priyanka@gmail.com      | family     | Two      |
| Neha      | kakkar   | Kothrud     | Pune      | Maharashtra | 411007 | 7092814637   | nehukakkar@gmail.com    | friend     | Two      |
| Aditya    | Kumar    | CDA         | Cuttack   | Odisha      | 753014 | 9638527410   | aditya.kumar@yahoo.com  | friend     | One      |
| Khusi     | Rout     | junagarh    | Kalahandi | Odisha      | 766001 | 2323231574   | khusirout999@yahoo.com  | profession | One      |
+-----------+----------+-------------+-----------+-------------+--------+--------------+-------------------------+------------+----------+
5 rows in set (0.00 sec)


========================================= UC10 =========================================


mysql> SELECT COUNT(firstName) FROM addressBook_table WHERE type ='family';
+------------------+
| COUNT(firstName) |
+------------------+
|                2 |
+------------------+
1 row in set (0.00 sec)

mysql> SELECT COUNT(firstName) FROM addressBook_table WHERE type ='friend';
+------------------+
| COUNT(firstName) |
+------------------+
|                2 |
+------------------+
1 row in set (0.00 sec)

mysql> SELECT COUNT(firstName) FROM addressBook_table WHERE type ='profession';
+------------------+
| COUNT(firstName) |
+------------------+
|                1 |
+------------------+
1 row in set (0.00 sec)
